{
  "$schema": "http://json-schema.org/draft-07/schema#",
  "$id": "https://valuechainmodel.schema/lifecycle_manifest.json",
  "title": "LifecycleManifest",
  "type": "object",
  "required": [
    "lifecycle_id",
    "name",
    "version",
    "description",
    "milestones"
  ],
  "properties": {
    "lifecycle_id": { "type": "string" },
    "overrides": { "type": "string" },
    "name": { "type": "string" },
    "version": { "type": "string" },
    "description": { "type": "string" },
    "milestones": {
      "type": "array",
      "items": {
        "type": "object",
        "required": ["step_id", "name", "order"],
        "properties": {
          "step_id": { "type": "string" },
          "name": { "type": "string" },
          "order": { "type": "integer" }
        }
      }
    },
    "phases": {
      "type": "array",
      "items": {
        "type": "object",
        "required": ["phase_id", "name", "milestones"],
        "properties": {
          "phase_id": { "type": "string" },
          "name": { "type": "string" },
          "milestones": {
            "type": "array",
            "items": { "type": "string" }
          }
        }
      }
    },
    "key_performance_indicators": {
      "type": "array",
      "items": { "type": "string" }
    }
  }
}
