{
  "lifecycle_id": "S2P",
  "name": "Source to Pay Lifecycle",
  "version": "1.0.0",
  "description": "End-to-end procurement lifecycle from spend identification and vendor sourcing through contract execution, PO issuance, invoice processing, and financial settlement.",
  "milestones": [
    { "step_id": "s2p_001_spend_analysis_need_id", "name": "Spend Analysis & Need Identification", "order": 1 },
    { "step_id": "s2p_002_supplier_discovery_qualification", "name": "Supplier Discovery & Qualification", "order": 2 },
    { "step_id": "s2p_003_sourcing_rfx_auction", "name": "Strategic Sourcing & RFx Execution", "order": 3 },
    { "step_id": "s2p_004_contracting_sla_negotiation", "name": "Contracting & SLA Negotiation", "order": 4 },
    { "step_id": "s2p_005_purchase_requisition_po", "name": "Purchase Requisition & PO Issuance", "order": 5 },
    { "step_id": "s2p_006_goods_services_receipt", "name": "Goods & Services Receipt Verification", "order": 6 },
    { "step_id": "s2p_007_invoice_verification_matching", "name": "Invoice 3-Way Matching & Exception Handling", "order": 7 },
    { "step_id": "s2p_008_payment_settlement_disbursement", "name": "Payment Settlement & Disbursement", "order": 8 }
  ],
  "phases": [
    {
      "phase_id": "sourcing",
      "name": "Strategic Sourcing & Contracting Phase",
      "milestones": [
        "s2p_001_spend_analysis_need_id",
        "s2p_002_supplier_discovery_qualification",
        "s2p_003_sourcing_rfx_auction",
        "s2p_004_contracting_sla_negotiation"
      ]
    },
    {
      "phase_id": "procure_to_pay",
      "name": "Procure-to-Pay (P2P) Phase",
      "milestones": [
        "s2p_005_purchase_requisition_po",
        "s2p_006_goods_services_receipt",
        "s2p_007_invoice_verification_matching",
        "s2p_008_payment_settlement_disbursement"
      ]
    }
  ],
  "key_performance_indicators": [
    "s2p_cycle_time_days",
    "po_automation_percentage",
    "first_pass_match_rate",
    "early_payment_discount_capture"
  ]
}
